{
  "schema_version": "ingestion.v1",
  "source_file": "CE_Class_Time_Table-EVEN_sem_25-26.docx",
  "semester": {
    "code": "EVEN",
    "academic_year": "2025-26",
    "term": "Even Semester 2025-26"
  },
  "departments": [
    { "id": "dept-ce", "code": "CE", "name": "Computer Engineering" },
    { "id": "dept-cse", "code": "CSE", "name": "Computer Science and Engineering" }
  ],
  "programmes": [
    { "id": "prog-ce-btech", "department_id": "dept-ce", "code": "BTECH", "name": "B.Tech Computer Engineering" },
    { "id": "prog-ce-mtech", "department_id": "dept-ce", "code": "MTECH", "name": "M.Tech Computer Engineering" }
  ],
  "divisions": [
    { "id": "div-se-comp-b", "programme_id": "prog-ce-btech", "semester_number": 4, "label": "SE-Comp B", "strength": 72 },
    { "id": "div-se-comp-c", "programme_id": "prog-ce-btech", "semester_number": 4, "label": "SE-Comp C", "strength": 70 },
    { "id": "div-se-comp-d", "programme_id": "prog-ce-btech", "semester_number": 4, "label": "SE-Comp D", "strength": 70 },
    { "id": "div-mtech-comp", "programme_id": "prog-ce-mtech", "semester_number": 2, "label": "M.Tech Comp", "strength": null }
  ],
  "batches": [
    { "id": "batch-se-b-a", "division_id": "div-se-comp-b", "label": "A", "strength": 18 },
    { "id": "batch-se-b-b", "division_id": "div-se-comp-b", "label": "B", "strength": 18 },
    { "id": "batch-se-b-c", "division_id": "div-se-comp-b", "label": "C", "strength": 18 },
    { "id": "batch-se-b-d", "division_id": "div-se-comp-b", "label": "D", "strength": 18 },
    { "id": "batch-se-c-a", "division_id": "div-se-comp-c", "label": "A", "strength": 18 },
    { "id": "batch-se-c-b", "division_id": "div-se-comp-c", "label": "B", "strength": 18 },
    { "id": "batch-se-c-c", "division_id": "div-se-comp-c", "label": "C", "strength": 17 },
    { "id": "batch-se-c-d", "division_id": "div-se-comp-c", "label": "D", "strength": 17 },
    { "id": "batch-se-d-a", "division_id": "div-se-comp-d", "label": "A", "strength": 18 },
    { "id": "batch-se-d-b", "division_id": "div-se-comp-d", "label": "B", "strength": 18 },
    { "id": "batch-se-d-c", "division_id": "div-se-comp-d", "label": "C", "strength": 17 },
    { "id": "batch-se-d-d", "division_id": "div-se-comp-d", "label": "D", "strength": 17 }
  ],
  "rooms": [
    {
      "id": "room-002",
      "code": "002",
      "capacity": 80,
      "room_type": "class",
      "separation": null,
      "sub_rooms": []
    },
    {
      "id": "room-508",
      "code": "508",
      "capacity": 160,
      "room_type": "class",
      "separation": null,
      "sub_rooms": []
    },
    {
      "id": "room-509-cse",
      "code": "509 new CSE",
      "capacity": 120,
      "room_type": "lab",
      "separation": null,
      "sub_rooms": []
    },
    {
      "id": "room-507-class",
      "code": "507",
      "capacity": 160,
      "room_type": "class",
      "separation": null,
      "sub_rooms": []
    },
    {
      "id": "room-507-lab",
      "code": "507",
      "capacity": 20,
      "room_type": "lab",
      "separation": null,
      "sub_rooms": []
    },
    {
      "id": "room-603",
      "code": "603",
      "capacity": 60,
      "room_type": "lab",
      "separation": "20-20-20",
      "sub_rooms": [
        { "id": "sub-603-1", "code": "603-1", "capacity": 20 },
        { "id": "sub-603-2", "code": "603-2", "capacity": 20 },
        { "id": "sub-603-3", "code": "603-3", "capacity": 20 }
      ]
    },
    {
      "id": "room-605",
      "code": "605",
      "capacity": 20,
      "room_type": "unknown",
      "separation": null,
      "sub_rooms": []
    },
    {
      "id": "room-606",
      "code": "606",
      "capacity": 40,
      "room_type": "lab",
      "separation": "20-20",
      "sub_rooms": [
        { "id": "sub-606-1", "code": "606-1", "capacity": 20 },
        { "id": "sub-606-2", "code": "606-2", "capacity": 20 }
      ]
    },
    {
      "id": "room-608",
      "code": "608",
      "capacity": 20,
      "room_type": "lab",
      "separation": null,
      "sub_rooms": []
    },
    {
      "id": "room-609",
      "code": "609",
      "capacity": 20,
      "room_type": "unknown",
      "separation": null,
      "sub_rooms": []
    },
    {
      "id": "room-702",
      "code": "702",
      "capacity": 60,
      "room_type": "lab",
      "separation": "20-20-20",
      "sub_rooms": [
        { "id": "sub-702-a", "code": "702-A", "capacity": 20 },
        { "id": "sub-702-b", "code": "702-B", "capacity": 20 },
        { "id": "sub-702-c", "code": "702-C", "capacity": 20 }
      ]
    }
  ],
  "faculty": [
    {
      "id": "fac-agn",
      "department_id": "dept-ce",
      "full_name": "A. G. Nikam",
      "initials": "AGN",
      "theory_hours": 6,
      "practical_hours": 8,
      "total_hours": 14
    },
    {
      "id": "fac-nr",
      "department_id": "dept-ce",
      "full_name": "N. Raut",
      "initials": "NR",
      "theory_hours": 4,
      "practical_hours": 12,
      "total_hours": 16
    },
    {
      "id": "fac-js",
      "department_id": "dept-ce",
      "full_name": "J. Shinde",
      "initials": "JS",
      "theory_hours": 4,
      "practical_hours": 8,
      "total_hours": 12
    },
    {
      "id": "fac-dn",
      "department_id": "dept-ce",
      "full_name": "D. Naik",
      "initials": "DN",
      "theory_hours": 2,
      "practical_hours": 8,
      "total_hours": 10
    },
    {
      "id": "fac-kkd",
      "department_id": "dept-ce",
      "full_name": "K. K. Deshpande",
      "initials": "KKD",
      "theory_hours": 8,
      "practical_hours": 4,
      "total_hours": 12
    },
    {
      "id": "fac-pbb",
      "department_id": "dept-ce",
      "full_name": "P. B. Bhosale",
      "initials": "PBB",
      "theory_hours": null,
      "practical_hours": null,
      "total_hours": null
    }
  ],
  "subjects": [
    { "id": "subj-os", "department_id": "dept-ce", "code": "OS", "name": "Operating Systems", "session_type": "both" },
    { "id": "subj-daa", "department_id": "dept-ce", "code": "DAA", "name": "Design and Analysis of Algorithms", "session_type": "both" },
    { "id": "subj-ccn", "department_id": "dept-ce", "code": "CCN", "name": "Computer Communication Networks", "session_type": "both" },
    { "id": "subj-pcs", "department_id": "dept-ce", "code": "PCS", "name": "Professional Communication Skills", "session_type": "lab" },
    { "id": "subj-et", "department_id": "dept-ce", "code": "ET", "name": "Emerging Technologies", "session_type": "both" }
  ],
  "qualifications": [
    { "faculty_id": "fac-agn", "subject_id": "subj-os", "source": "observed" },
    { "faculty_id": "fac-agn", "subject_id": "subj-et", "source": "observed" },
    { "faculty_id": "fac-nr", "subject_id": "subj-daa", "source": "observed" },
    { "faculty_id": "fac-js", "subject_id": "subj-ccn", "source": "observed" },
    { "faculty_id": "fac-dn", "subject_id": "subj-pcs", "source": "observed" },
    { "faculty_id": "fac-kkd", "subject_id": "subj-os", "source": "observed" },
    { "faculty_id": "fac-kkd", "subject_id": "subj-daa", "source": "declared" }
  ],
  "cohorts": [
    {
      "id": "coh-div-se-b",
      "cohort_type": "division",
      "label": "SE-Comp B",
      "member_batch_ids": ["batch-se-b-a", "batch-se-b-b", "batch-se-b-c", "batch-se-b-d"]
    },
    {
      "id": "coh-div-se-c",
      "cohort_type": "division",
      "label": "SE-Comp C",
      "member_batch_ids": ["batch-se-c-a", "batch-se-c-b", "batch-se-c-c", "batch-se-c-d"]
    },
    { "id": "coh-batch-se-b-a", "cohort_type": "batch", "label": "SE-Comp B / A", "member_batch_ids": ["batch-se-b-a"] },
    { "id": "coh-batch-se-b-b", "cohort_type": "batch", "label": "SE-Comp B / B", "member_batch_ids": ["batch-se-b-b"] },
    { "id": "coh-batch-se-b-c", "cohort_type": "batch", "label": "SE-Comp B / C", "member_batch_ids": ["batch-se-b-c"] },
    { "id": "coh-batch-se-b-d", "cohort_type": "batch", "label": "SE-Comp B / D", "member_batch_ids": ["batch-se-b-d"] },
    {
      "id": "coh-comb-se-cd",
      "cohort_type": "combined",
      "label": "SE C & D",
      "member_batch_ids": [
        "batch-se-c-a", "batch-se-c-b", "batch-se-c-c", "batch-se-c-d",
        "batch-se-d-a", "batch-se-d-b", "batch-se-d-c", "batch-se-d-d"
      ]
    },
    {
      "id": "coh-elec-pe-i-d",
      "cohort_type": "elective",
      "label": "PE-I-D",
      "member_batch_ids": ["batch-se-c-c", "batch-se-d-a"]
    }
  ],
  "observed_sessions": [
    {
      "id": "obs-0001",
      "subject_id": "subj-os",
      "faculty_id": "fac-agn",
      "cohort_id": "coh-batch-se-b-a",
      "room_id": "room-702",
      "sub_room_id": "sub-702-a",
      "day": 0,
      "period": 1,
      "duration_periods": 2,
      "session_type": "lab",
      "source_cell": "OS / A / AGN / 702-A"
    },
    {
      "id": "obs-0002",
      "subject_id": "subj-daa",
      "faculty_id": "fac-nr",
      "cohort_id": "coh-batch-se-b-b",
      "room_id": "room-603",
      "sub_room_id": "sub-603-2",
      "day": 0,
      "period": 1,
      "duration_periods": 2,
      "session_type": "lab",
      "source_cell": "DAA / B / NR / 603-2"
    },
    {
      "id": "obs-0003",
      "subject_id": "subj-ccn",
      "faculty_id": "fac-js",
      "cohort_id": "coh-batch-se-b-c",
      "room_id": "room-606",
      "sub_room_id": null,
      "day": 0,
      "period": 1,
      "duration_periods": 2,
      "session_type": "lab",
      "source_cell": "CCN / C / JS / 606-4"
    },
    {
      "id": "obs-0004",
      "subject_id": "subj-pcs",
      "faculty_id": "fac-dn",
      "cohort_id": "coh-batch-se-b-d",
      "room_id": "room-608",
      "sub_room_id": null,
      "day": 0,
      "period": 1,
      "duration_periods": 2,
      "session_type": "lab",
      "source_cell": "PCS / D / DN / 608"
    },
    {
      "id": "obs-0005",
      "subject_id": "subj-daa",
      "faculty_id": "fac-nr",
      "cohort_id": "coh-comb-se-cd",
      "room_id": "room-508",
      "sub_room_id": null,
      "day": 1,